slug,name,sector,employment,employment_millions,median_pay_inr,median_pay_lakh,education_code,education_label,hiring_trend_code,hiring_trend_label,ai_exposure,ai_rationale,source
welders-fitters,Welders & fitters,Construction,3200000,3.2,260000,2.6,3,ITI / Diploma,1,Growing (3-10% YoY),1,"The role is highly manual, requiring physical dexterity, on-site work, and minimal digital interaction, limiting AI automation to peripheral tooling assistance. While AI‑driven design or planning tools exist, they do not replace the core welding and fitting tasks.",NSDC CSSC + NSDC IISC
painters,Painters (building / decorative),Construction,2400000,2.4,200000,2.0,1,None / Primary school,0,Flat (essentially unchanged),1,"Painting is a manual, physical task requiring dexterity, surface preparation, and on‑site judgment; AI tools have limited relevance and cannot replicate the hands‑on work. Digital automation potential is minimal, so exposure remains low despite any design‑software assistance.",NSDC CSSC
bar-benders,Bar benders & steel fixers,Construction,1900000,1.9,235000,2.4,1,None / Primary school,1,Growing (3-10% YoY),1,"Bar bending and steel fixing are manual, on‑site tasks requiring physical dexterity and real‑time judgment in variable construction environments. AI tools have little relevance to the core work, and Indian labor cost advantages keep the role labor‑intensive. Hence exposure to automation is minimal.",NSDC CSSC
tile-marble-layers,Tile & marble layers,Construction,1400000,1.4,240000,2.4,1,None / Primary school,1,Growing (3-10% YoY),1,"Tile and marble laying is a physically intensive, manual trade with minimal digital work product; AI can only assist tools (e.g., layout planning) but cannot replace the hands‑on skill. Physical labor and low education level keep automation exposure low despite any productivity aids.",NSDC CSSC
hvac-technicians,AC / HVAC technicians,Construction,950000,0.95,280000,2.8,3,ITI / Diploma,2,Strong growth (10-25% YoY),2,"HVAC technicians perform hands‑on installation, repair, and maintenance of physical systems, relying on manual dexterity and on‑site judgment. AI can assist with diagnostics or predictive maintenance tools, but core work remains physical and location‑bound, limiting automation potential in India’s construction sector.",NSDC ESSCI
construction-surveyors,Surveyors & site supervisors,Construction,420000,0.42,380000,3.8,3,ITI / Diploma,0,Flat (essentially unchanged),3,"Work is largely on‑site, requiring physical measurement, judgment of terrain, and real‑time supervision, with only limited assistance from digital tools like GPS or BIM. AI can augment planning and data capture, but cannot replace the hands‑on, location‑specific tasks central to surveying and site supervision.",NSDC CSSC
garment-workers,Garment & apparel workers,Manufacturing,5000000,5.0,165000,1.6,1,None / Primary school,-1,Slowly declining (<3% YoY drop or stagnant),2,"The role is primarily manual, involving physical sewing, cutting, and assembly with minimal digital output. AI can aid design and planning but cannot perform the dexterous, real‑time tasks on the shop floor, keeping exposure low despite modest productivity gains.",AEPC + Apparel Made-Ups SSC
leather-workers,Leather & footwear workers,Manufacturing,1700000,1.7,165000,1.6,1,None / Primary school,0,Flat (essentially unchanged),1,"Leather and footwear work is highly manual, involving cutting, stitching, and finishing physical materials with minimal digital interaction. AI tools can aid design or inventory but cannot replace the dexterous, tactile tasks central to production, especially given low automation investment in Indian manufacturing.",CLE + LSSC
jewelry-artisans,Jewelry artisans & karigars,Manufacturing,2100000,2.1,200000,2.0,1,None / Primary school,0,Flat (essentially unchanged),2,"The work is highly manual, requiring fine motor skills and tactile judgment to craft jewelry, with minimal digital output. AI can assist in design visualization but cannot replace the physical crafting, keeping exposure low despite modest productivity aids.",GJSCI
handicraft-artisans,Handicraft & handloom artisans,Manufacturing,3500000,3.5,110000,1.1,1,None / Primary school,-1,Slowly declining (<3% YoY drop or stagnant),1,"Work is highly manual, tactile, and location‑specific, with little digital output; AI can only assist design inspiration or inventory, which does not replace core crafting. Physical dexterity and cultural nuances create strong barriers to automation.",Office of Development Commissioner (Handicrafts)
pottery-ceramics,Pottery & ceramics workers,Manufacturing,480000,0.48,130000,1.3,1,None / Primary school,-1,Slowly declining (<3% YoY drop or stagnant),1,"Pottery and ceramics work is highly manual, requiring tactile skill, kiln operation, and physical shaping of materials, with little digital output. AI can assist in design simulation but cannot replace the hands‑on crafting, so exposure remains minimal.",Khadi & Village Industries Commission
pharma-manufacturing,Pharma manufacturing workers,Manufacturing,950000,0.95,320000,3.2,3,ITI / Diploma,2,Strong growth (10-25% YoY),2,"The role is largely physical, involving equipment operation, batch handling, and manual quality checks in factories, with limited digital output. AI can assist in predictive maintenance and process monitoring, but core tasks require hands‑on dexterity and real‑time judgment, keeping exposure low despite modest productivity gains.",Pharmexcil + LSSSDC
steel-foundry-workers,Steel & foundry workers,Manufacturing,1300000,1.3,280000,2.8,2,10th / 12th class,0,Flat (essentially unchanged),2,"Work is primarily manual metal casting and furnace operation with limited digital output; AI can assist in process monitoring and predictive maintenance but cannot replace the physical dexterity and onsite decision‑making required. Hence exposure is low, around the lower end of the 2‑3 range.",Indian Steel Association
chemical-plant-operators,Chemical plant operators,Manufacturing,850000,0.85,360000,3.6,3,ITI / Diploma,1,Growing (3-10% YoY),2,"The role is primarily physical, involving manual operation, monitoring, and safety oversight of chemical processes, with limited digital work product. AI can assist with predictive maintenance and process optimization, but cannot replace on‑site human judgment and dexterity, keeping exposure low.",NSDC PSSC
food-processing,Food processing workers,Manufacturing,2200000,2.2,195000,1.9,1,None / Primary school,1,Growing (3-10% YoY),2,"Work is largely manual, involving physical handling, cleaning, and packaging of food with minimal digital interaction. AI-driven robotics are limited in India due to capital constraints and cheap labor, so automation potential is low, though some AI‑assisted quality monitoring may assist.",Food Industry Capacity & Skill Initiative (FICSI)
electronics-assembly,Electronics assembly workers,Manufacturing,1500000,1.5,230000,2.3,2,10th / 12th class,3,Booming (>25% YoY),2,"Electronics assembly is a hands‑on, dexterity‑intensive manufacturing role with minimal digital output; AI can aid tooling and quality inspection but cannot replace the manual assembly work, especially given India's capital constraints and cheap labor.",ELCINA + ESSCI
kirana-store-owners,Kirana store owners & staff,Retail & Trade,13000000,13.0,220000,2.2,2,10th / 12th class,-1,Slowly declining (<3% YoY drop or stagnant),2,"Kirana work is largely physical—stocking shelves, handling cash, face‑to‑face sales—so AI can only augment inventory management or pricing, not replace the role. Limited digital product and low wage arbitrage keep exposure modest despite some automation tools.",RAI + CAIT estimates
ecommerce-sellers,E-commerce sellers (online merchants),Retail & Trade,1400000,1.4,320000,3.2,2,10th / 12th class,2,Strong growth (10-25% YoY),7,"The role is largely digital—listing products, pricing, and customer chat are AI‑automatable, and AI tools can boost productivity enough to reduce seller numbers. However, physical sourcing, logistics, and trust‑based buyer interactions remain human‑centric, limiting full replacement.",ONDC + Industry estimates
street-vendors,Street vendors & hawkers,Retail & Trade,10000000,10.0,130000,1.3,1,None / Primary school,0,Flat (essentially unchanged),1,"Street vending is a physical, face‑to‑face retail activity with minimal digital output; AI tools cannot replace the on‑site sales, negotiation, and mobility required. Limited automation potential keeps exposure low despite any peripheral inventory or payment apps.",NASVI + Street Vendors Act census
data-scientists,Data scientists,IT Services & Software,320000,0.32,1400000,14.0,4,Bachelor's degree,2,Strong growth (10-25% YoY),8,"Data scientists produce fully digital outputs (code, models, analyses) that AI‑driven AutoML and LLM tools can generate or accelerate, making the role highly augmentable and potentially reducing demand. In India’s export‑oriented IT services, productivity gains quickly erode wage arbitrage, raising exposure. However, domain expertise and client interaction still require human judgment, keeping the score below 9.",NASSCOM Talent Demand 2025
ml-engineers,ML / AI engineers,IT Services & Software,280000,0.28,1800000,18.0,4,Bachelor's degree,3,Booming (>25% YoY),8,"The role is fully digital, producing code, models, and data pipelines that AI tools can generate, test, and optimize, dramatically boosting productivity and eroding offshore cost advantages. While deep expertise remains needed, AI already handles large portions of routine engineering work, placing the occupation in the high‑exposure bracket.",NASSCOM + AIM Research
devops-sre,DevOps & site reliability engineers,IT Services & Software,240000,0.24,1500000,15.0,4,Bachelor's degree,2,Strong growth (10-25% YoY),7,"DevOps/SRE work is fully digital—code deployment, infrastructure as code, monitoring dashboards, and incident response are increasingly automated with AI‑driven observability and auto‑remediation tools. While AI can boost productivity and reduce headcount needs, complex architecture design, cross‑team coordination, and nuanced reliability decisions still require human expertise, keeping exposure high but not total.",NASSCOM + industry surveys
cybersecurity-pros,Cybersecurity professionals,IT Services & Software,350000,0.35,1200000,12.0,4,Bachelor's degree,3,Booming (>25% YoY),7,"Cybersecurity work is largely digital—log monitoring, threat hunting, vulnerability assessment—areas where AI already automates large portions and boosts productivity. However, strategic decision‑making, incident response, and nuanced risk judgment still require human expertise, keeping the role defensible despite high automation potential.",DSCI + NASSCOM Cyber Talent Report
cloud-engineers,Cloud engineers / architects,IT Services & Software,380000,0.38,1600000,16.0,4,Bachelor's degree,2,Strong growth (10-25% YoY),7,"Cloud engineering is a fully digital knowledge role involving architecture design, infrastructure‑as‑code, and performance optimization, all of which AI tools can automate or augment substantially. While AI can boost productivity and reduce headcount needs, the need for deep system integration, security judgment, and client‑specific customization keeps a strong human component.",NASSCOM Cloud Talent Survey
mobile-app-devs,Mobile app developers,IT Services & Software,410000,0.41,950000,9.5,4,Bachelor's degree,1,Growing (3-10% YoY),8,"Mobile app development is a fully digital knowledge task; LLMs and code‑generation tools can write, test, and debug large portions of code, dramatically boosting productivity and reducing offshore demand. While architectural design and client interaction remain human‑centric, the core coding work is highly automatable, placing the role in the 8‑range for AI exposure.",NASSCOM Talent Demand
qa-testing,QA / test engineers,IT Services & Software,480000,0.48,750000,7.5,4,Bachelor's degree,-1,Slowly declining (<3% YoY drop or stagnant),8,"QA testing is a largely digital knowledge task involving writing test cases, executing scripts, and analyzing software behavior, all of which AI/LLM-driven test generation and automated execution can perform today. In India's export‑oriented IT services, AI dramatically boosts productivity, threatening large portions of the 480k tester workforce, though some manual exploratory testing remains.",NASSCOM + IT Services HR data
dba-data-engineers,Database admins & data engineers,IT Services & Software,220000,0.22,1100000,11.0,4,Bachelor's degree,1,Growing (3-10% YoY),7,"The role is fully digital, involving database management, pipeline coding, and data modeling, which AI can automate (auto‑tuning, ETL generation, query assistance). In India's export‑oriented IT services, AI‑driven productivity gains can sharply reduce required staff, though design and governance still need human oversight.",NASSCOM
ux-ui-designers,UX / UI designers,IT Services & Software,180000,0.18,950000,9.5,4,Bachelor's degree,1,Growing (3-10% YoY),7,"UX/UI design is a fully digital knowledge job where generative AI can produce wireframes, mockups, and design suggestions, dramatically boosting productivity. However, nuanced user research, brand strategy, and iterative decision‑making still require human insight, keeping the role defensible despite strong export‑oriented pressure in India.",NASSCOM Design Industry Insights
tech-writers,Technical writers,IT Services & Software,95000,0.1,850000,8.5,4,Bachelor's degree,-1,Slowly declining (<3% YoY drop or stagnant),8,"Technical writing is a fully digital knowledge task; LLMs can already draft, edit, and format documentation, reducing demand for human writers. In India, the role is export‑oriented and wage‑sensitive, so AI productivity gains quickly erode the cost advantage, driving a declining hiring trend.",STC India + industry estimates
blockchain-devs,Blockchain & Web3 developers,IT Services & Software,75000,0.07,1500000,15.0,4,Bachelor's degree,1,Growing (3-10% YoY),8,"Blockchain/Web3 development is a fully digital coding role; LLMs can already generate smart contracts, audit code, and assist architecture, dramatically boosting productivity and eroding offshore price advantage. While deep domain expertise remains valuable, the core tasks are highly automatable, placing the occupation in the high‑exposure bracket.",NASSCOM + Blockchain Council
gcc-cybersecurity,GCC cybersecurity teams,Global Capability Centres,130000,0.13,2200000,22.0,4,Bachelor's degree,3,Booming (>25% YoY),7,"Cybersecurity work is highly digital—log analysis, threat hunting, incident response—all increasingly assisted or partially automated by AI-driven analytics and autonomous response tools. While human expertise for nuanced judgment and strategy remains essential, AI can boost productivity dramatically, reshaping team sizes in export‑oriented GCCs.",Zinnov GCC 2025
gcc-fa,GCC finance & accounting,Global Capability Centres,180000,0.18,1600000,16.0,4,Bachelor's degree,0,Flat (essentially unchanged),8,"GCC finance & accounting work is largely digital—processing invoices, reconciliations, reporting, and routine analysis—all tasks that LLMs and automation tools can perform today with high accuracy. India's export‑oriented finance services amplify exposure, as AI productivity gains quickly erode low‑cost labor arbitrage. Human judgment remains for complex judgments, keeping the score below 9.",Zinnov GCC 2025
gcc-product-mgmt,GCC product management,Global Capability Centres,60000,0.06,3500000,35.0,4,Bachelor's degree,2,Strong growth (10-25% YoY),7,"Product managers in GCCs work primarily with digital artifacts—roadmaps, data dashboards, and collaborative platforms—making the role highly augmentable by AI for market analysis, prioritization, and documentation. AI can boost productivity and reduce headcount needs, but strategic decision‑making and client relationship nuances keep a strong human component.",Zinnov GCC 2025
kpo-research,KPO / research analysts,BPM / BPO,320000,0.32,720000,7.2,4,Bachelor's degree,-1,Slowly declining (<3% YoY drop or stagnant),9,"Research analysts produce digital reports, synthesize data, and write content—all tasks that LLMs already perform at near‑human quality, enabling 3‑5× productivity gains and eroding offshore price advantage. The role is export‑oriented, highly digital, and shows declining hiring, indicating strong AI reshaping.",NASSCOM BPM Strategic Review
content-moderation,Content moderation ops,BPM / BPO,75000,0.07,380000,3.8,2,10th / 12th class,1,Growing (3-10% YoY),8,"Content moderation is a fully digital task that AI models already perform at scale, handling text, image, and video screening. In India's export‑oriented BPM sector, AI can replace a large share of the work, though human reviewers remain for nuanced cases and policy enforcement.",Industry estimates (Trust & Safety Professionals)
customer-success,Customer success ops (SaaS),BPM / BPO,90000,0.09,800000,8.0,4,Bachelor's degree,2,Strong growth (10-25% YoY),8,"The role is largely digitalâmanaging SaaS client data, monitoring usage metrics, and communicating via CRM/emailâmaking it highly automatable with AI-driven analytics, chatbots, and workflow orchestration. In India's{{
{{
 acacacacacacacacacacacacacacacacacacacacacacacacacacacacacacacacacacacacacacacacacacacacacacacacacacacacacacacacacacacacacacacacacacacacacacacacacacacacacacacacacacacacacacacacacacacacacacacacacacacacacacacacacacacacacacacacacacacacacacacacacacacacacacacacacacacacacacacacacacacacacacacacacacacacacacacacacacacacacacacacacacacacacacacacacacacacacacacacacacacacacacacacacacacacacacacacacacacacacacacacacacacacacacacacacacacacacacacacacacacacacacacacacacacacacacacacacacacacacacacacacacacacacacacacacacacacacacacacacacacacacacacacacacacacacacacacacacacacacacacacacacacacacacacacacacacacacacacacacacacacacacacacacacacacacacacacacacacacacacacacacacacacacacacacacacacacacacacacacacacacacacacacacacacacacacacacacacacacacacacacacacacacacacacacacacacacacacacacacacacacacacacacacacacacacacacacacacacacacacacacacacacacacacacacacacacacacacacacacacacacacacacacacacacacacacacacacacacacacacacacacacacacac",NASSCOM SaaS report
tax-professionals,Tax professionals (non-CA),"Banking, Finance, Insurance",420000,0.42,480000,4.8,4,Bachelor's degree,0,Flat (essentially unchanged),8,"Tax work is highly digital—data entry, document analysis, compliance filing, and advisory are all software‑driven and increasingly automatable with LLMs and specialized tax AI tools. In India, many of these roles support export‑oriented finance services, so productivity gains can sharply reduce demand. Regulatory protections may slow adoption, but the underlying task exposure is strong.",ICAI + AICTE estimates
company-secretaries,Company secretaries (CS),"Banking, Finance, Insurance",65000,0.07,950000,9.5,5,"Master's / Professional (CA, MBBS, LLB)",0,Flat (essentially unchanged),7,"Company secretaries work heavily with digital documents, regulatory filings, and governance reporting, which AI can draft, review, and automate, boosting productivity dramatically. While nuanced legal judgment and stakeholder interaction remain human‑centric, the core knowledge‑work is highly digitizable, leading to strong exposure.",Institute of Company Secretaries of India
mutual-fund-distributors,Mutual fund distributors,"Banking, Finance, Insurance",280000,0.28,480000,4.8,4,Bachelor's degree,1,Growing (3-10% YoY),5,"The role relies on client interaction and trust‑based sales, but much of the back‑office work (KYC, portfolio analysis, product recommendation) is increasingly digitised and can be assisted or partially replaced by AI‑driven robo‑advisors and automation tools. Hence AI will reshape significant parts of the job without fully substituting the human distributor.",AMFI
wealth-managers,Wealth managers / RIA,"Banking, Finance, Insurance",110000,0.11,1500000,15.0,4,Bachelor's degree,2,Strong growth (10-25% YoY),6,"Wealth management relies heavily on digital data analysis, portfolio modeling, and client communication, making it highly augmentable by AI tools. However, the advisory relationship, trust, and regulatory compliance require human judgment, limiting full automation. In India, the role is largely domestic and high‑pay, so wage arbitrage pressures are modest, keeping exposure at a strong‑augmentation level.",SEBI Registered Investment Advisor data
treasury-forex,Treasury & forex operations,"Banking, Finance, Insurance",55000,0.06,1400000,14.0,4,Bachelor's degree,0,Flat (essentially unchanged),8,"Treasury and forex work is highly digital—data analysis, trade execution, reporting, and compliance can be automated or dramatically accelerated by AI and algorithmic systems. In India, these roles are often offshore service‑export functions, so AI‑driven productivity gains directly erode the cost advantage, raising exposure. While some judgment and relationship management remain, core tasks are already being performed by AI tools.",FEDAI + RBI
actuaries,Actuaries,"Banking, Finance, Insurance",16000,0.02,1800000,18.0,5,"Master's / Professional (CA, MBBS, LLB)",1,Growing (3-10% YoY),8,"Actuarial work is heavily digital, involving statistical modeling, data analysis, and report generation, which AI/LLM tools can perform with high accuracy. AI can automate many pricing, reserving, and risk‑assessment tasks, dramatically increasing productivity and reducing demand for junior actuaries, though senior judgment and regulatory compliance remain human‑centric.",Institute of Actuaries of India
civil-services,All India Services (IAS/IPS/IFS),Government & Public Sector,11000,0.01,1900000,19.0,5,"Master's / Professional (CA, MBBS, LLB)",0,Flat (essentially unchanged),2,"IAS/IPS/IFS roles involve high‑level policy, governance, field inspections and discretionary decision‑making that rely on political judgment and human interaction, with limited digital work products. AI can assist with data analysis and document drafting, but core responsibilities remain non‑digital and trust‑based, yielding low exposure.",DoPT Civil List
judiciary-staff,Judges & court staff,Government & Public Sector,380000,0.38,950000,9.5,5,"Master's / Professional (CA, MBBS, LLB)",0,Flat (essentially unchanged),5,"Judges and court staff perform legal reasoning, case management, and courtroom interaction that require nuanced human judgment and in‑person presence, limiting full automation. AI can substantially augment research, document drafting, and scheduling, reshaping parts of the workflow, especially in a digitizing Indian judiciary, but core decision‑making remains human.",Department of Justice + e-Courts
income-tax-customs,Income tax & customs officers,Government & Public Sector,95000,0.1,1000000,10.0,4,Bachelor's degree,0,Flat (essentially unchanged),5,"The role involves substantial document analysis, data verification, and risk assessment, which can be aided by AI-driven analytics and OCR, but also requires discretionary judgment, field inspections, and legal authority that are hard to automate. In India, strong regulatory and bureaucratic safeguards limit rapid digital replacement, keeping exposure moderate.",CBDT + CBIC
asha-workers,ASHA community health workers,Government & Public Sector,1050000,1.05,70000,0.7,2,10th / 12th class,0,Flat (essentially unchanged),2,"ASHA workers perform in‑person health education, home visits, and basic data collection, tasks that rely on physical presence and interpersonal trust. AI can assist with mobile reporting tools, but core duties remain manual and non‑digital, limiting exposure to automation.",MoHFW NHM
anganwadi-workers,Anganwadi workers & helpers,Government & Public Sector,2700000,2.7,90000,0.9,2,10th / 12th class,0,Flat (essentially unchanged),1,"Work is largely physical, community‑based childcare, nutrition monitoring, and face‑to‑face education, requiring personal interaction and manual tasks. AI tools have minimal relevance to core duties, and limited digitalization in this low‑skill public sector role.",Ministry of Women & Child Development
forest-service,Forest service staff (state),Government & Public Sector,165000,0.17,520000,5.2,4,Bachelor's degree,0,Flat (essentially unchanged),1,"Work is primarily outdoor, involving field monitoring, enforcement, and manual data collection, with limited digital output. AI tools can aid analysis of satellite data but cannot replace on‑ground presence, so exposure remains low.",MoEFCC + state forest depts
municipal-staff,Municipal corporation staff,Government & Public Sector,1100000,1.1,280000,2.8,2,10th / 12th class,0,Flat (essentially unchanged),3,"Work is largely administrative and field‑based with low digital output; AI can assist with document routing and basic data entry but core tasks require human interaction, local knowledge, and regulatory judgment. Limited digitization in Indian municipal bodies keeps exposure modest.",Census of India + MoHUA
election-officials,Election Commission officials,Government & Public Sector,18000,0.02,950000,9.5,4,Bachelor's degree,0,Flat (essentially unchanged),3,"The role is largely administrative and field‑based, involving coordination, legal compliance, and on‑site supervision rather than purely digital output. AI can aid document processing and data analysis, but core tasks require human judgment, political discretion, and physical presence, limiting automation potential in the Indian context.",ECI
